<?xml version="1.0" encoding="UTF-8"?>
<!-- XML Sample Message of message hierarchy                                          -->
<!-- Message:             ADC SAL Invoices Generated v1.0 Rev. 3                      -->
<!-- Transaction:         AA - Audit Data Collection Rev. 235                         -->
<!-- Datamodel:           Audit Data Collection Datamodel, version HEAD Rev. 312      -->
<!-- XML tagset used:     AdcsML                                                      -->
<!-- Generated at:        23-01-2021 17:36:42                                         -->
<!-- Generated using:     EC-Design 2.5.0 (http://www.ec-design.nl)                   -->
<!-- Generated by:        Jan Vrijenhoek (Digitect)                                   -->
<!-- Organisation:        Digitect B.V. (Digitect)                                    -->
<!-- NOTE:    This sample message was generated automatically: manual modifications will be lost -->
<AdcSalInvoicesGenerated xsi:schemaLocation="http://schemas.iso.org/AdcsML/Messages/AdcSalInvoicesGenerated-v1 AdcSalInvoicesGenerated-v1.0.xsd"
		xmlns="http://schemas.iso.org/AdcsML/Messages/AdcSalInvoicesGenerated-v1"
		xmlns:xsi="http://www.w3.org/2001/XMLSchema-instance">
	<SalInvoiGen>
		<InvoiId>I001</InvoiId>
		<InvoiNr>IN1234</InvoiNr>
		<FiscYr>2020</FiscYr>
		<AcntingPer>M1</AcntingPer>
		<OfficialInvoiCd>INV001</OfficialInvoiCd>
		<InvoiTypNm>Short term delivery</InvoiTypNm>
		<InvoiDt>2020-02-01</InvoiDt>
		<InvoiDueDt>2020-02-15</InvoiDueDt>
		<CustAcntId>C00001</CustAcntId>
		<SetlMthdCd>SC1</SetlMthdCd>
		<InvoiTrAmt>10000.0000</InvoiTrAmt>
		<InvoiTrCurCd>USD</InvoiTrCurCd>
		<PayTermCd>PT1</PayTermCd>
		<TrmsDscntPerc>0.0100</TrmsDscntPerc>
		<TrmsDscntDays>15</TrmsDscntDays>
		<TrmsDueDays>15</TrmsDueDays>
		<GrpCd>GR1</GrpCd>
		<Stat>NEW</Stat>
		<Rmrk>Rush delivery.</Rmrk>
		<BusSgX>BS001</BusSgX>
		<Tax>
			<TaxTypCd>TAX01</TaxTypCd>
			<TaxTrAmt>10000.0000</TaxTrAmt>
		</Tax>
		<Crea>
			<UserId>JD</UserId>
			<Dt>2020-03-02</Dt>
			<Tm>09:31</Tm>
		</Crea>
		<Aprv>
			<UserId>JD</UserId>
			<Dt>2020-03-02</Dt>
			<Tm>09:31</Tm>
		</Aprv>
		<LstMdf>
			<UserId>JD</UserId>
			<Dt>2020-03-02</Dt>
			<Tm>09:31</Tm>
		</LstMdf>
	</SalInvoiGen>
</AdcSalInvoicesGenerated>
